<?xml version="1.0" encoding="UTF-8" ?>
<vallalat xmlns:xsi="http://www.w3.org/2001/XMLSchema-instance"
 xsi:noNamespaceSchemaLocation="XMLSchemaY4O4X0.xsd">
 <!--Részlegek-->
 <reszleg rkod="r1">
    <nev>Elektronika</nev>
    <emelet>2</emelet>
    <letszam>12</letszam>
    <!--Csapatok-->
    <csapat cskod="cs1">
        <vezeto>Szabó Ernő</vezeto>
        <letszam>8</letszam>
        <elorehaladas>30</elorehaladas>
        <!--Dolgozok-->
        <dolgozo dkod="d1">
            <fizetes>3000000</fizetes>
            <vegzettseg>Bsc diploma</vegzettseg>
            <belepesiDatum>2006-02-02</belepesiDatum>
            <beosztas bkod="b1">
                <munkaido>
                    <tol>10:00:00</tol>
                    <ig>18:00:00</ig>
                </munkaido>
                <pozicio>Szoftverfejlesztő</pozicio>
            </beosztas>
        </dolgozo>
        <dolgozo dkod="d2">
            <fizetes>2000</fizetes>
            <vegzettseg>Középfokú végzettség</vegzettseg>
            <belepesiDatum>2010-01-21</belepesiDatum>
            <beosztas bkod="bkod2">
                <munkaido>
                    <tol>10:00:00</tol>
                    <ig>18:00:00</ig>
                </munkaido>
                <pozicio>Tesztelő</pozicio>
            </beosztas>
        </dolgozo>
        <dolgozo dkod="d3">
            <fizetes>300000</fizetes>
            <vegzettseg>Bsc diploma</vegzettseg>
            <belepesiDatum>2000-03-03</belepesiDatum>
            <beosztas bkod="bkod3">
                <munkaido>
                    <tol>10:00:00</tol>
                    <ig>18:00:00</ig>
                </munkaido>
                <pozicio>Tesztelő</pozicio>
            </beosztas>
        </dolgozo>
    </csapat>
    <csapat cskod="cs2">
        <vezeto>Nagy István</vezeto>
        <letszam>43</letszam>
        <elorehaladas>75</elorehaladas>
        <dolgozo dkod="d4">
            <fizetes>242000</fizetes>
            <vegzettseg>Bsc diploma</vegzettseg>
            <belepesiDatum>2017-03-08</belepesiDatum>
            <beosztas bkod="cs1">
                <munkaido>
                    <tol>10:00:00</tol>
                    <ig>18:00:00</ig>
                </munkaido>
                <pozicio>Projekt menedzser</pozicio>
            </beosztas>
        </dolgozo>
    </csapat>
    <csapat cskod="cs3">
        <vezeto>Kovács András</vezeto>
        <letszam>15</letszam>
        <elorehaladas>45</elorehaladas>
        <dolgozo dkod="d5">
            <fizetes>3000000</fizetes>
            <vegzettseg>Bsc diploma</vegzettseg>
            <belepesiDatum>2011-11-10</belepesiDatum>
            <beosztas bkod="cs1">
                <munkaido>
                    <tol>10:00:00</tol>
                    <ig>18:00:00</ig>
                </munkaido>
                <pozicio>Szoftverfejlesztő</pozicio>
            </beosztas>
        </dolgozo>
    </csapat>
    <!--Projektek-->
    <projekt pkod="p1">
        <nev>Fejlesztési projekt</nev>
        <felelos>Szabó Ernő</felelos>
        <hatarido>2024-02-02</hatarido>
    </projekt>
    <projekt pkod="p7">
        <nev>Karbantartási projekt</nev>
        <felelos>Kovács András</felelos>
        <hatarido>2024-05-15</hatarido>
    </projekt>
    <projekt pkod="p4">
        <nev>Tesztelési projekt</nev>
        <felelos>Nagy István</felelos>
        <hatarido>2024-03-30</hatarido>
    </projekt>
    <!--Ügyfelek-->
    <ugyfel ukod="u1">
        <nev>János és Társai Kft.</nev>
        <adoszam>12345678-1-12</adoszam>
        <cim>
            <varos>Miskolc</varos>
            <utca>Petőfi út</utca>
            <hazszam>22</hazszam>
        </cim>
        <email>janostarsai@gmail.com</email>
    </ugyfel>
</reszleg>
<!--Részleg-->
<reszleg rkod="r2">
    <nev>Marketing</nev>
    <emelet>3</emelet>
    <letszam>10</letszam>
    <csapat cskod="cs1">
        <vezeto>Kiss Anna</vezeto>
        <letszam>5</letszam>
        <elorehaladas>60</elorehaladas>
        <dolgozo dkod="d1">
            <fizetes>4000000</fizetes>
            <vegzettseg>Msc diploma</vegzettseg>
            <belepesiDatum>2015-05-12</belepesiDatum>
            <beosztas bkod="b1">
                <munkaido>
                    <tol>09:00:00</tol>
                    <ig>17:00:00</ig>
                </munkaido>
                <pozicio>Tesztelő</pozicio>
            </beosztas>
        </dolgozo>
        <dolgozo dkod="d2">
            <fizetes>3500000</fizetes>
            <vegzettseg>Bsc diploma</vegzettseg>
            <belepesiDatum>2018-03-04</belepesiDatum>
            <beosztas bkod="bkod2">
                <munkaido>
                    <tol>09:00:00</tol>
                    <ig>17:00:00</ig>
                </munkaido>
                <pozicio>Szoftverfejlesztő</pozicio>
            </beosztas>
        </dolgozo>
        <dolgozo dkod="d3">
            <fizetes>2500000</fizetes>
            <vegzettseg>Bsc diploma</vegzettseg>
            <belepesiDatum>2017-08-19</belepesiDatum>
            <beosztas bkod="bkod3">
                <munkaido>
                    <tol>09:00:00</tol>
                    <ig>17:00:00</ig>
                </munkaido>
                <pozicio>Mérnök</pozicio>
            </beosztas>
        </dolgozo>
    </csapat>
    <csapat cskod="cs2">
        <vezeto>Nagy Zoltán</vezeto>
        <letszam>5</letszam>
        <elorehaladas>45</elorehaladas>
        <dolgozo dkod="d4">
            <fizetes>3000000</fizetes>
            <vegzettseg>Bsc diploma</vegzettseg>
            <belepesiDatum>2020-09-11</belepesiDatum>
            <beosztas bkod="cs1">
                <munkaido>
                    <tol>09:00:00</tol>
                    <ig>17:00:00</ig>
                </munkaido>
                <pozicio>Projekt menedzser</pozicio>
            </beosztas>
        </dolgozo>
    </csapat>
    <projekt pkod="p2">
        <nev>Brand Építés</nev>
        <felelos>Kiss Anna</felelos>
        <hatarido>2024-03-15</hatarido>
    </projekt>
    <projekt pkod="p8">
        <nev>SEO Optimalizálás</nev>
        <felelos>Nagy Zoltán</felelos>
        <hatarido>2024-04-20</hatarido>
    </projekt>
    <ugyfel ukod="u2">
        <nev>XY Kft.</nev>
        <adoszam>87654321-1-12</adoszam>
        <cim>
            <varos>Debrecen</varos>
            <utca>Fő utca</utca>
            <hazszam>10</hazszam>
        </cim>
        <email>xykft@domain.com</email>
    </ugyfel>
</reszleg>
<reszleg rkod="r3">
    <nev>HR</nev>
    <emelet>2</emelet>
    <letszam>6</letszam>
    <csapat cskod="cs1">
        <vezeto>Tóth Péter</vezeto>
        <letszam>3</letszam>
        <elorehaladas>80</elorehaladas>
        <dolgozo dkod="d1">
            <fizetes>5000000</fizetes>
            <vegzettseg>Msc diploma</vegzettseg>
            <belepesiDatum>2012-10-10</belepesiDatum>
            <beosztas bkod="b1">
                <munkaido>
                    <tol>09:00:00</tol>
                    <ig>17:00:00</ig>
                </munkaido>
                <pozicio>Projekt menedzser</pozicio>
            </beosztas>
        </dolgozo>
        <dolgozo dkod="d2">
            <fizetes>3500000</fizetes>
            <vegzettseg>Bsc diploma</vegzettseg>
            <belepesiDatum>2015-05-22</belepesiDatum>
            <beosztas bkod="bkod2">
                <munkaido>
                    <tol>09:00:00</tol>
                    <ig>17:00:00</ig>
                </munkaido>
                <pozicio>Mérnök</pozicio>
            </beosztas>
        </dolgozo>
        <dolgozo dkod="d3">
            <fizetes>3000000</fizetes>
            <vegzettseg>Bsc diploma</vegzettseg>
            <belepesiDatum>2018-07-05</belepesiDatum>
            <beosztas bkod="bkod3">
                <munkaido>
                    <tol>09:00:00</tol>
                    <ig>17:00:00</ig>
                </munkaido>
                <pozicio>Mérnök</pozicio>
            </beosztas>
        </dolgozo>
    </csapat>
    <csapat cskod="cs2">
        <vezeto>Varga Eszter</vezeto>
        <letszam>3</letszam>
        <elorehaladas>70</elorehaladas>
        <dolgozo dkod="d4">
            <fizetes>2500000</fizetes>
            <vegzettseg>Bsc diploma</vegzettseg>
            <belepesiDatum>2019-11-14</belepesiDatum>
            <beosztas bkod="cs1">
                <munkaido>
                    <tol>09:00:00</tol>
                    <ig>17:00:00</ig>
                </munkaido>
                <pozicio>Aszisztens</pozicio>
            </beosztas>
        </dolgozo>
    </csapat>
    <projekt pkod="p3">
        <nev>Alkalmazotti elégedettség felmérés</nev>
        <felelos>Tóth Péter</felelos>
        <hatarido>2024-06-30</hatarido>
    </projekt>
    <projekt pkod="p9">
        <nev>Jutalom és elismerés program</nev>
        <felelos>Varga Eszter</felelos>
        <hatarido>2024-08-15</hatarido>
    </projekt>
    <ugyfel ukod="u3">
        <nev>ABC Tanácsadó Kft.</nev>
        <adoszam>11223344-1-12</adoszam>
        <cim>
            <varos>Szeged</varos>
            <utca>Kossuth Lajos utca</utca>
            <hazszam>15</hazszam>
        </cim>
        <email>abctanacsado@gmail.com</email>
    </ugyfel>
</reszleg>
</vallalat>